{
  "status": "ready",
  "mode": "preserve-template-scaffold",
  "artifacts": {
    "build_report": ".office-auto/state/1780069744/build_report.json",
    "qa_report": ".office-auto/state/1780069744/qa_report.json"
  },
  "target_file": "/home/minhquang/office-auto/report.docx",
  "source_file": "/home/minhquang/office-auto/chuong_2.md",
  "template_file": "/home/minhquang/office-auto/format_template.docx"
}