{
  "mode_requested": "preserve-template-scaffold",
  "mode": "preserve-template-scaffold",
  "source_file": "/home/minhquang/office-auto/chuong_2.md",
  "template_file": "/home/minhquang/office-auto/format_template.docx",
  "target_file": "/home/minhquang/office-auto/report.docx",
  "preserve": [
    "headers-footers",
    "page-setup",
    "section-breaks",
    "styles-and-numbering",
    "toc"
  ],
  "replace_ranges": [
    {
      "name": "after-front-matter-to-end-of-main-story",
      "status": "resolved",
      "paragraph_start_index": 42,
      "paragraph_end_index": 56,
      "preserves_front_matter": true
    }
  ],
  "artifacts": {
    "content_ast": ".office-auto/state/run-002/content_ast.json",
    "content_outline": ".office-auto/state/run-002/content_outline.json",
    "template_profile": ".office-auto/state/run-002/template_profile.json",
    "plan": ".office-auto/state/run-002/plan.json",
    "build_report": ".office-auto/state/run-002/build_report.json",
    "qa_report": ".office-auto/state/run-002/qa_report.json"
  },
  "status": "ready"
}
